{
  "$schema": "stage-transition-request.schema.json",
  "program_id": "<program-id>",
  "from_stage_id": "<current-stage-instance-id>",
  "from_gate": "G0",
  "from_target": "<current-ledger-target-id>",
  "from_revision": 1,
  "artifact": "<current-stage-artifact>",
  "to_gate": "G1",
  "to_stage_id": "<next-stage-instance-id>",
  "to_target": "<next-ledger-target-id>",
  "to_task": "<next-stage-prompt>",
  "status": "ready",
  "owner_decision": null,
  "decision_inventory": null,
  "blockers": null,
  "checks": [
    "current_gate=<evidence-path>",
    "source_freshness=<evidence-path>",
    "next_stage_inputs=<evidence-path>",
    "write_scope=<evidence-path>",
    "foreign_changes=<evidence-path>",
    "execution_route=N/A",
    "handoff_artifact=<next-prompt-path>"
  ],
  "summary": "<concise-owner-facing-stage-result>",
  "review_artifacts": [],
  "questions": []
}
